{
  "aggregate_sha256": "2fa444de042e742e9763b6a4988205b7f05d5374d6cf66fa94d20c7efd26fd70",
  "blockers": [
    "btc_10s_research_admission_not_yet_rebuilt_from_this_manifest"
  ],
  "coverage": {
    "end": "2026-08-27T11:13:35.206Z",
    "start": "2026-08-27T11:12:39.209Z"
  },
  "data_schema": "btc_okx_10s_microstructure_immutable_feed_v1",
  "dataset_id": "btc-okx-10s-microstructure-immutable-feed",
  "dataset_version": "btc-okx-10s-feed-00000001-20260827t111218925177z-src4e615032a6",
  "file_count": 24,
  "files": [
    {"bytes": 1679, "path": "capture/okx_public_ws_l2_raw_capture_manifest.json", "sha256": "8838e8718f1bcaf4a3617a97272dcb876e4bd55f0e32bac15c1e56516c74fcd7"},
    {"bytes": 1228839, "path": "capture/okx_public_ws_l2_raw_messages.jsonl", "sha256": "6f6a7d256c2581cd506ef9f6dd10215dfec4182a8ce2f8a1f1f66f4298b96130"},
    {"bytes": 4184, "path": "capture_report.json", "sha256": "1f0d43fa5dec70c5375a1f1d675a3c736fee6faeeaf2afbcb6a59f8177706f3d"},
    {"bytes": 14545, "path": "clock/btc_okx_server_time_preflight_report.json", "sha256": "6c59d83eeb59361c91406c7d0d2de653c93457ee9d85b246a6f0f0bd04895e2f"},
    {"bytes": 798, "path": "clock/btc_okx_server_time_preflight_safety_status.json", "sha256": "f5aa14f24865a764d651c5b7927633440784206cded0932f1f2c2f512c77ee27"},
    {"bytes": 657, "path": "clock/btc_okx_server_time_preflight_summary_cn.md", "sha256": "3d725f1320f82cd8f91a49a1abadfdc114c15c1f1332635a009cb3a901650921"},
    {"bytes": 97, "path": "clock/okx_server_time_raw/server_time_raw_1.json", "sha256": "58785f225536de923318df4d4bb48fd3d728ec810a2599322870034b2ee80eda"},
    {"bytes": 97, "path": "clock/okx_server_time_raw/server_time_raw_10.json", "sha256": "a20a56a3df29fdf9b33ea6e0339a58833fafa022328c6cc1acefa024316cd2a0"},
    {"bytes": 97, "path": "clock/okx_server_time_raw/server_time_raw_11.json", "sha256": "e6ab09b9b3ec2ac4ad2598a097da1f370a85b466c924656b123959ede9d0d3ba"},
    {"bytes": 97, "path": "clock/okx_server_time_raw/server_time_raw_2.json", "sha256": "e874da2791b2ea107fcdcb2b8cb45d13ccb56f072abc9940e8480c870aa3dd3e"},
    {"bytes": 97, "path": "clock/okx_server_time_raw/server_time_raw_3.json", "sha256": "240c908ef7c6a59bd1c6bd388f205b835ff2c2f5decfc5c880f45dc8cad1b571"},
    {"bytes": 97, "path": "clock/okx_server_time_raw/server_time_raw_4.json", "sha256": "a09420f224dbb78f80a1323a60856f0d5c8f4ba0eb5010f98b6846e0684901e1"},
    {"bytes": 97, "path": "clock/okx_server_time_raw/server_time_raw_5.json", "sha256": "ffb04df5bb80c372d1dedaa60a909db0483213435ac5be00f1b704961185439f"},
    {"bytes": 97, "path": "clock/okx_server_time_raw/server_time_raw_6.json", "sha256": "f9445e155cd3dedc67a1cabacf42104e47e1650ac7b01b55899feeeabd6202b6"},
    {"bytes": 97, "path": "clock/okx_server_time_raw/server_time_raw_7.json", "sha256": "5b1022206d8c26e24e23f27d23574c797c63ece70c6b07ff636d645ecf25e0bd"},
    {"bytes": 97, "path": "clock/okx_server_time_raw/server_time_raw_8.json", "sha256": "8ce1798ed5f1db21460ed84284b76002a361df49745b179adc364bed73e1d9ff"},
    {"bytes": 97, "path": "clock/okx_server_time_raw/server_time_raw_9.json", "sha256": "a39257ff8e2189328e7d2c580e66ec43b6e5690d5659d649a5c533f75e24b577"},
    {"bytes": 15699, "path": "feed_slice_metadata.json", "sha256": "fe8ce609c9535b91cb93e19a95ce68c5b30e2ec5284e328443168038d2521ee3"},
    {"bytes": 3660, "path": "immutable_export/btc_okx_10s_microstructure_immutable_feed_attestation.json", "sha256": "985d29f3b87608969358a410ba6ec36021fc9f8bccaaab1bf148881175142d21"},
    {"bytes": 218732, "path": "immutable_export/normalized-trades/venue=okx/instrument_id=BTC-USDT-SWAP/date=2026-08-27/part-00000.jsonl", "sha256": "a70af5ec606b5ef6349fe76182fe6235947a68b58fcc07120c8c865b2618d16b"},
    {"bytes": 4650, "path": "immutable_export/ordered-l2/btc_okx_l2_dataready_attestation.json", "sha256": "4a25046401acae17abc19be06f841d093c1c2804c4336519932897d0b52a349c"},
    {"bytes": 8978855, "path": "immutable_export/ordered-l2/venue=okx/instrument_id=BTC-USDT-SWAP/date=2026-08-27/part-00000.jsonl", "sha256": "415a6986fed022a7714ecdc1108730049ee2856d2dc4167534a5b9acda144262"},
    {"bytes": 1679, "path": "immutable_export/raw/segment-00000001/okx_public_ws_l2_raw_capture_manifest.json", "sha256": "8838e8718f1bcaf4a3617a97272dcb876e4bd55f0e32bac15c1e56516c74fcd7"},
    {"bytes": 1228839, "path": "immutable_export/raw/segment-00000001/okx_public_ws_l2_raw_messages.jsonl", "sha256": "6f6a7d256c2581cd506ef9f6dd10215dfec4182a8ce2f8a1f1f66f4298b96130"}
  ],
  "guardrails": {
    "consumer_read_only": true,
    "immutable_version": true,
    "order_endpoint_used": false,
    "paper_or_live_unlock_allowed": false,
    "private_endpoint_used": false,
    "promotion_unlock_allowed": false
  },
  "known_gaps": [],
  "producer_commit": "4e615032a6ca223531235aadf7b1da32b8f235a7",
  "producer_role": "data_steward",
  "published_at": "2026-08-27T11:13:38Z",
  "quality_status": "pass_with_research_only_warnings",
  "readiness_class": "quality_checked",
  "schema_version": "shared_dataset_manifest_v1",
  "storage_relative_path": "datasets/btc-okx-10s-microstructure-immutable-feed/btc-okx-10s-feed-00000001-20260827t111218925177z-src4e615032a6",
  "total_bytes": 11703883
}
